{
  "schemaVersion": "1.0",
  "eventId": "evt_run_observed_01JTEST",
  "eventType": "run.observed",
  "occurredAt": "2026-08-14T00:00:00.000Z",
  "producer": { "product": "control", "version": "0.3.0" },
  "correlation": { "suiteId": "suite_01JTEST", "taskId": "TASK-SYNTHETIC", "runId": "run_01JTEST" },
  "capabilities": ["run.read"],
  "payload": { "runState": "running", "mode": "read-only", "worktreeState": "ready" }
}
