{
  "schemaVersion": "2.0",
  "eventId": "evt_unsupported_major_01JTEST",
  "eventType": "run.observed",
  "occurredAt": "2026-08-14T00:00:00.000Z",
  "producer": { "product": "control", "version": "0.3.0" },
  "correlation": { "suiteId": "suite_01JTEST", "runId": "run_01JTEST" },
  "payload": { "runState": "running", "mode": "read-only", "worktreeState": "ready" }
}
