{
  "schemaVersion": "1.0",
  "eventId": "evt_approval_observed_01JTEST",
  "eventType": "approval.observed",
  "occurredAt": "2026-08-14T00:00:00.000Z",
  "producer": { "product": "control", "version": "0.3.0" },
  "correlation": { "suiteId": "suite_01JTEST", "runId": "run_01JTEST" },
  "payload": { "decision": "approved", "decisionAt": "2026-08-14T00:00:00.000Z", "scope": "worktree.change" }
}
