{
  "schemaVersion": "1.0",
  "eventId": "evt_capability_observed_01JTEST",
  "eventType": "capability.observed",
  "occurredAt": "2026-08-14T00:00:00.000Z",
  "producer": { "product": "chef", "version": "0.5.72" },
  "correlation": { "suiteId": "suite_01JTEST" },
  "payload": { "capability": "routing.read", "availability": "available", "reasonCode": "available" }
}
