{
  "schemaVersion": "1.0",
  "eventId": "evt_suite_snapshot_01JTEST",
  "eventType": "suite.snapshot",
  "occurredAt": "2026-08-14T00:00:00.000Z",
  "producer": { "product": "chef", "version": "0.5.72" },
  "correlation": { "suiteId": "suite_01JTEST" },
  "payload": { "state": "available", "observedAt": "2026-08-14T00:00:00.000Z", "sourceRevision": "rev_01JTEST" }
}
